<?xml version="1.0" encoding="iso-8859-1"?>
<xsd:schema xmlns:xsd=="http://www.w3.org/XMLSchema">
<xsd:element name="ursuppe">
 <xsd:complexType>
  <xsd:sequence>
   <xsd:element name="genecard" maxOccurs="unbounded"/>
    <xsd:complexType>
     <xsd:sequence>
      <xsd:element name="alias" type="xsd:string" minOccurs="1" maxOccurs="1"/>
      <xsd:element name="name" type="xsd:string" minOccurs="1" maxOccurs="1"/> 
     </xsd:sequence>
    </xsd:complexType>
   </xsd:sequence>
  </xsd:complexType> 
 </xsd:element>
</xsd:schema>